#queryIndex	queryItem	stringId	preferredName	annotation
1	AT5G14720	3702.Q84WU5	T9L3.20	Protein kinase superfamily protein.
2	AT4G14000	3702.Q8VY62	Dl3040W	Putative methyltransferase family protein.
3	AT3G14270	3702.Q9LUM0	FAB1B	1-phosphatidylinositol-3-phosphate 5-kinase FAB1B; The PI(3,5)P2 regulatory complex regulates both the synthesis and turnover of phosphatidylinositol 3,5-bisphosphate (PtdIns(3,5)P2). Catalyzes the phosphorylation of phosphatidylinositol 3-phosphate on the fifth hydroxyl of the myo-inositol ring, to form phosphatidylinositol 3,5-bisphosphate (By similarity). Plays an important role in maintenance of endomembrane homeostasis including endocytosis, vacuole formation, and vacuolar acidification processes. Required for development of viable pollen. Might mediate recycling of auxin transporters.
4	AT5G61500	3702.Q0WWQ1	ATG3	Autophagy-related protein 3; E2 conjugating enzyme responsible for the E2-like covalent binding of phosphatidylethanolamine to the C-terminal Gly of ATG8. This step is required for the membrane association of ATG8. The formation of the ATG8-phosphatidylethanolamine conjugate is essential for autophagy and for the cytoplasm to vacuole transport (Cvt); Belongs to the ATG3 family.
5	AT5G51210	3702.Q43284	OL3	Oleosin 14.9 kDa; May have a structural role to stabilize the lipid body during desiccation of the seed by preventing coalescence of the oil. Probably interacts with both lipid and phospholipid moieties of lipid bodies. May also provide recognition signals for specific lipase anchorage in lipolysis during seedling growth (By similarity).
6	At3g24540	3702.Q1PEM5	PERK3	Proline-rich receptor-like protein kinase PERK3; Belongs to the protein kinase superfamily. Ser/Thr protein kinase family.
7	AT4G29380	3702.Q9M0E5	VPS15	Serine/threonine-protein kinase VPS15; Serine/threonine-protein kinase required for cytoplasm to vacuole transport (Cvt) and autophagy as a part of the autophagy- specific VPS34 PI3-kinase complex I (By similarity). Required for pollen development and germination, probably via the modulation of phosphatidylinositol 3-phosphate (PI3P) formation and vacuolar organization.
8	AT3G57990	3702.Q9M2P9	T10K17.200	Uncharacterized protein T10K17.200.
9	AT4G18040	3702.O23252	EIF4E1	Eukaryotic translation initiation factor 4E-1; Component of the protein complex eIF4F, which is involved in the recognition of the mRNA cap, ATP-dependent unwinding of 5'-terminal secondary structure and recruitment of mRNA to the ribosome. Recognizes and binds the 7-methylguanosine-containing mRNA cap during an early step in the initiation of protein synthesis and facilitates ribosome binding by inducing the unwinding of the mRNAs secondary structures (By similarity); Belongs to the eukaryotic initiation factor 4E family.
10	AT2G34570	3702.Q8L8C2	MEE21	PIN domain-like family protein.
11	AT1G68100	3702.Q9M647	IAR1	IAA-alanine resistance protein 1; May participate in auxin metabolism or response. Probable transporter; Belongs to the ZIP transporter (TC 2.A.5) family. KE4/Catsup subfamily.
12	AT5G20610	3702.F4K5K6	PMIR1	Protein PLASTID MOVEMENT IMPAIRED 1-RELATED 1; Together with PMI1, necessary for chloroplast and nuclear photorelocation movements via the regulation of chloroplast-actin (cp- actin) filaments in pavement cells.
13	AT3G13530	3702.Q9LJD8	M3KE1	MAP3K epsilon protein kinase 1; Serine/threonine-protein kinase involved in the spatial and temporal control system organizing cortical activities in mitotic and postmitotic cells. Required for the normal functioning of the plasma membrane in developing pollen. Involved in the regulation of cell expansion, cell elongation, and embryo development.
14	AT1G44575	3702.Q9XF91	PSBS	Photosystem II 22 kDa protein, chloroplastic; Plays an important role in non-photochemical quenching, a process maintains the balance between dissipation and utilization of light energy to minimize generation of oxidizing molecules, thereby protecting the plant against photo-oxidative damage. Is not necessary for efficient light harvesting and photosynthesis. Belongs to the ELIP/psbS family.
15	AT1G79610	3702.Q8RWU6	NHX6	Sodium/hydrogen exchanger 6; Involved in trafficking to the vacuole. Required for cell proliferation and cell expansion, but not for cell differentiation. May act in low affinity electroneutral exchange of protons for cations such as Na(+) or K(+) across membranes. May also exchange Li(+) and Cs(+) with a lower affinity (By similarity); Belongs to the monovalent cation:proton antiporter 1 (CPA1) transporter (TC 2.A.36) family.
16	AT5G25780	3702.Q8GUM1	EIF3B-2	Eukaryotic translation initiation factor 3 subunit B; Component of the eukaryotic translation initiation factor 3 (eIF-3) complex, which is involved in protein synthesis and, together with other initiation factors, stimulates binding of mRNA and methionyl-tRNAi to the 40S ribosome; Belongs to the eIF-3 subunit B family.
17	AT5G14720	3702.Q84WU5	T9L3.20	Protein kinase superfamily protein.
18	AT3G46450	3702.F4J934	F4J934_ARATH	SEC14 cytosolic factor family protein / phosphoglyceride transfer family protein.
19	AT1G67000	3702.Q3ECH2	LRK10L-2.8	LEAF RUST 10 DISEASE-RESISTANCE LOCUS RECEPTOR-LIKE PROTEIN KINASE-like 2.8.
20	AT1G79280	3702.A4GSN8	NUA	Nuclear-pore anchor; Component of the nuclear pore complex. Acts as a docking site for activities required for desumoylation and mRNA export. Required for the proper expression or localization of a subset of miRNAs. Plays a role in meristematic cell division by interacting with spindle assembly checkpoint proteins.
21	AT2G34970	3702.O64760	F19I3.20	Putative translation initiation factor eIF-2B epsilon subunit.
22	AT5G50570	3702.B9DI20	SPL13A	Squamosa promoter-binding-like protein 13A; Trans-acting factor that binds specifically to the consensus nucleotide sequence 5'-TNCGTACAA-3'.
23	AT5G50670	3702.P0DI11	SPL13B	Squamosa promoter-binding-like protein 13B; Trans-acting factor that binds specifically to the consensus nucleotide sequence 5'-TNCGTACAA-3'.
24	AT4G02010	3702.Q8L7V7	T10M13.2	Protein kinase superfamily protein.
25	AT4G36020	3702.O65639	CSP1	Cold shock protein 1; Chaperone that binds to RNA, single- (ssDNA) and double- stranded (dsDNA) DNA, and unwinds nucleic acid duplex. Exhibits a DNA melting activity. May be involved in cold resistance. Prevents seed germination under dehydration or salt stress conditions.
26	AT5G02490	3702.P22954	HSP70-2	Heat shock 70 kDa protein 2; In cooperation with other chaperones, Hsp70s are key components that facilitate folding of de novo synthesized proteins, assist translocation of precursor proteins into organelles, and are responsible for degradation of damaged protein under stress conditions. Belongs to the heat shock protein 70 (TC 1.A.33) family. DnaK subfamily.
27	AT3G60860	3702.Q9LZX8	BIG2	Brefeldin A-inhibited guanine nucleotide-exchange protein 2; Activates the ARF proteins by exchanging bound GDP for free GTP. Plays a role in vesicular protein sorting (By similarity).
28	AT1G69340	3702.Q94JV1	F10D13.28	Appr-1-p processing enzyme family protein.
29	AT3G24290	3702.Q9LK16	AMT1-5	Putative ammonium transporter 1 member 5; Involved in ammonium transport; Belongs to the ammonia transporter channel (TC 1.A.11.2) family.
30	AT5G18070	3702.P57750	DRT101	Phosphoacetylglucosamine mutase; Interconverts GlcNAc-6-P and GlcNAc-1-P; Belongs to the phosphohexose mutase family.
31	AT4G17890	3702.Q8H100	AGD8	Probable ADP-ribosylation factor GTPase-activating protein AGD8; GTPase-activating protein (GAP) for ADP ribosylation factor (ARF).
32	AT3G58090	3702.F4J4N3	DIR17	Dirigent protein 17; Dirigent proteins impart stereoselectivity on the phenoxy radical-coupling reaction, yielding optically active lignans from two molecules of coniferyl alcohol in the biosynthesis of lignans, flavonolignans, and alkaloids and thus plays a central role in plant secondary metabolism.
33	AT4G28790	3702.Q9SVU6	BHLH23	Transcription factor bHLH23.
34	AT1G79030	3702.F4IDH6	YUP8H12R.35	Chaperone DnaJ-domain superfamily protein.
35	AT1G13220	3702.Q9SAF6	CRWN2	Protein CROWDED NUCLEI 2; Component of SUN-protein-containing multivariate complexes also called LINC complexes which link the nucleoskeleton and cytoskeleton by providing versatile outer nuclear membrane attachment sites for cytoskeletal filaments (By similarity). Required for nucleus structure organization (e.g. size and shape).
36	AT1G31870	3702.Q9C6S8	F5M6.12	Pre-mRNA-splicing factor of RES complex protein.
37	AT1G11480	3702.Q94C21	T23J18.15	Eukaryotic translation initiation factor-like protein.
38	AT3G53720	3702.Q9M353	CHX20	Cation/H(+) antiporter 20; Operates as a K(+)/H(+) antiporter that maintains K(+) homeostasis in guard cells and could regulate pH. Plays a critical role in osmoregulation through the control of stomates opening. Belongs to the monovalent cation:proton antiporter 2 (CPA2) transporter (TC 2.A.37) family. CHX (TC 2.A.37.4) subfamily.
39	AT1G30480	3702.P42698	DRT111	DNA-damage-repair/toleration protein DRT111, chloroplastic; Seems to be involved in the resistance to UV light and chemical DNA-damaging agents. Regulates the splicing of the receptor-like kinase SNC4/LRKL-2.6.
40	AT2G40060	3702.O04209	CLC2	Clathrin light chain 2; Clathrin is the major protein of the polyhedral coat of coated pits and vesicles.
41	AT3G22220	3702.Q9LIE1	Q9LIE1_ARATH	HAT transposon superfamily.
42	AT2G21440	3702.Q9SJT4	F3K23.20	RNA-binding (RRM/RBD/RNP motifs) family protein.
43	AT3G19420	3702.Q9LT75	PTEN2A	Phosphatidylinositol 3,4,5-trisphosphate 3-phosphatase and protein-tyrosine-phosphatase PTEN2A; Binds phosphatidic acid. Protein tyrosine phosphatase that exhibits also lipid phosphatase activity. Hydrolyzed poorly p- nitrophenyl phosphate (p-NPP). Can use PtdIns isomers as substrates. Removes efficiently phosphate from the D3 position of the inositol ring, less from the D4 position and not at all from the D5 position on monophosphorylated PtdIns isomers (PIPs). The presence of a phosphate group in the D5 position on PIP(2) isomers reduces lipid phosphatase activity. Mostly active on P [...] 
44	AT3G01930	3702.Q9S7R2	F1C9.29	Major facilitator superfamily protein.
45	ATMG00860	3702.P92523	M860_ARATH	Uncharacterized mitochondrial protein AtMg00860.
46	AT2G02560	3702.Q8L5Y6	CAND1	Cullin-associated NEDD8-dissociated protein 1; Key assembly factor of SCF (SKP1-CUL1-F-box protein) E3 ubiquitin ligase complexes that promotes the exchange of the substrate- recognition F-box subunit in SCF complexes, thereby playing a key role in the cellular repertoire of SCF complexes. Acts as a F-box protein exchange factor (By similarity). Required for SCF(TIR1) function. Modulates SCF(TIR1) function through its interactions with the CUL1 subunit. Represses photomorphogenesis by promoting HY5 degradation in darkness. Belongs to the CAND family.
47	AT1G02520	3702.Q9FWX7	ABCB11	ABC transporter B family member 11.
48	AT2G14835	3702.Q944Q6	Q944Q6_ARATH	RING/U-box superfamily protein.
49	AT1G67590	3702.Q9SR48	F12B7.14	Remorin family protein.
50	AT2G47300	3702.F4IL30	POP1	Ribonuclease Ps.
51	AT5G65690	3702.A0A1P8BDT8	PCK2	Phosphoenolpyruvate carboxykinase 2.
52	AT4G36690	3702.O23212	U2AF65A	Splicing factor U2af large subunit A; Necessary for the splicing of pre-mRNA; Belongs to the splicing factor SR family.
53	AT3G63400	3702.Q9LY75	CYP63	Peptidyl-prolyl cis-trans isomerase CYP63; PPIases accelerate the folding of proteins. It catalyzes the cis-trans isomerization of proline imidic peptide bonds in oligopeptides. May be implicated in the folding, transport, and assembly of proteins. Probably involved in early steps of spliceosomal assembly.
54	AT4G31580	3702.O81126	RSZ22	Serine/arginine-rich splicing factor RSZ22; Sequence-specific RNA-binding protein probably involved in pre-mRNA splicing. In vitro, can complement efficiently splicing- deficient mammalian SRSF7-depleted HeLa cell extract. Belongs to the splicing factor SR family. RSZ subfamily.
55	AT1G18610	3702.Q9FZ82	F25I16.5	Galactose oxidase/kelch repeat superfamily protein.
56	AT3G11670	3702.Q9S7D1	DGD1	Digalactosyldiacylglycerol synthase 1, chloroplastic; Involved in the synthesis of diacylglycerol galactolipids that are specifically found in thylakoid membranes. Specific for alpha- glycosidic linkages. Responsible for the final assembly of galactolipids in photosynthetic membranes. Digalactosyldiacylglycerol (DGDG) provides stability to the photosystem I (PSI) complex, especially to the PsaA, PsaB, PsaC, PsaL and PsaH subunits. Belongs to the glycosyltransferase group 1 family. Glycosyltransferase 4 subfamily.
57	AT4G00990	3702.Q8VYB9	Q8VYB9_ARATH	Transcription factor jumonji (JmjC) domain-containing protein.
58	AT1G64030	3702.Q9SH52	SRP3	Serpin-Z1; Probable serine protease inhibitor.
59	AT1G52360	3702.Q9C827	F19K6.16	Coatomer subunit beta'-2; The coatomer is a cytosolic protein complex that binds to dilysine motifs and reversibly associates with Golgi non-clathrin- coated vesicles, which further mediate biosynthetic protein transport from the ER, via the Golgi up to the trans Golgi network. Coatomer complex is required for budding from Golgi membranes, and is essential for the retrograde Golgi-to-ER transport of dilysine-tagged proteins (By similarity); Belongs to the WD repeat COPB2 family.
60	AT4G10310	3702.Q84TI7	HKT1	Sodium transporter HKT1; Sodium transporter protein, which plays a central role in plant tolerance to salt. Upon prolongated exposure to high concentrations, Na(+) translocates from the roots to the transpiring leaves where it can increase to toxic level. Involved in Na(+) recirculation from shoots to roots, probably by mediating Na(+) loading into the phloem sap in shoots and unloading in roots, thereby removing large amounts of Na(+) from the shoot. Does not transport K(+) but regulates K(+) nutrient status via its ability to facilitate Na(+) homeostasis. Probably not involved in roo [...] 
61	AT2G37370	3702.F4IQ39	F3G5.16	Centrosomal protein of 135 kDa-like protein.
62	AT2G47330	3702.O22907	RH24	DEAD-box ATP-dependent RNA helicase 24; Belongs to the DEAD box helicase family.
63	AT1G79610	3702.Q8RWU6	NHX6	Sodium/hydrogen exchanger 6; Involved in trafficking to the vacuole. Required for cell proliferation and cell expansion, but not for cell differentiation. May act in low affinity electroneutral exchange of protons for cations such as Na(+) or K(+) across membranes. May also exchange Li(+) and Cs(+) with a lower affinity (By similarity); Belongs to the monovalent cation:proton antiporter 1 (CPA1) transporter (TC 2.A.36) family.
64	AT3G01780	3702.F4J8D3	TPLATE	Protein TPLATE; Functions in vesicle-trafficking events required for site- specific cell wall modifications during pollen germination and for anchoring of the cell plate to the mother wall at the correct cortical position; Belongs to the TPLATE family.
65	AT3G10900	3702.Q9SG95	MAN4	Putative mannan endo-1,4-beta-mannosidase 4; Belongs to the glycosyl hydrolase 5 (cellulase A) family.
66	AT4G36690	3702.O23212	U2AF65A	Splicing factor U2af large subunit A; Necessary for the splicing of pre-mRNA; Belongs to the splicing factor SR family.
67	AT1G29030	3702.Q8GXH2	F28N24.26	Apoptosis inhibitory protein 5 (API5).
68	AT1G20970	3702.F4HWC3	F9H16.4	Calponin-like domain protein.
69	AT1G31780	3702.Q6NMI3	COG6	Conserved oligomeric Golgi complex subunit 6; Required for normal Golgi function.
70	AT2G01320	3702.Q9ZU35	ABCG7	ABC transporter G family member 7; Belongs to the ABC transporter superfamily. ABCG family. Eye pigment precursor importer (TC 3.A.1.204) subfamily.
71	AT5G25780	3702.Q8GUM1	EIF3B-2	Eukaryotic translation initiation factor 3 subunit B; Component of the eukaryotic translation initiation factor 3 (eIF-3) complex, which is involved in protein synthesis and, together with other initiation factors, stimulates binding of mRNA and methionyl-tRNAi to the 40S ribosome; Belongs to the eIF-3 subunit B family.
72	AT5G25780	3702.Q8GUM1	EIF3B-2	Eukaryotic translation initiation factor 3 subunit B; Component of the eukaryotic translation initiation factor 3 (eIF-3) complex, which is involved in protein synthesis and, together with other initiation factors, stimulates binding of mRNA and methionyl-tRNAi to the 40S ribosome; Belongs to the eIF-3 subunit B family.
73	AT1G63110	3702.F4I1Z0	F16M19.3	GPI transamidase subunit PIG-U.
74	AT5G42870	3702.Q9FMN2	PAH2	Phosphatidate phosphatase PAH2; Magnesium-dependent phosphatidate phosphatase which catalyzes the dephosphorylation of phosphatidate to yield diacylglycerol. Acts redundantly with PAH1 to repress phospholipid biosynthesis at the endoplasmic reticulum (ER). May function indirectly as repressor of multiple enzymes involved in phospholipid biosynthesis. Is involved in the pathway of galactolipid synthesis in the ER, which is required for the membrane lipid remodeling, an essential adaptation mechanism to cope with phosphate starvation.
75	AT5G22640	3702.Q8LPR8	TIC100	Protein TIC 100; Involved in protein precursor import into chloroplasts. May be part of an intermediate translocation complex acting as a protein- conducting channel at the inner envelope. Plays an important role during embryogenesis and chloroplast biogenesis.
76	AT5G05570	3702.Q9FFF8	MOP10.11	Transducin family protein / WD-40 repeat family protein.
77	AT1G73860	3702.Q0WN69	KIN14P	Kinesin-like protein KIN-14P; Belongs to the TRAFAC class myosin-kinesin ATPase superfamily. Kinesin family. KIN-14 subfamily.
78	AT2G37370	3702.F4IQ39	F3G5.16	Centrosomal protein of 135 kDa-like protein.
79	AT5G14720	3702.Q84WU5	T9L3.20	Protein kinase superfamily protein.
80	AT3G21630	3702.A8R7E6	CERK1	Chitin elicitor receptor kinase 1; Lysin motif (LysM) receptor kinase that functions as a cell surface receptor in chitin elicitor (chitooligosaccharides) signaling leading to innate immunity toward both biotic and abiotic stresses (e.g. tolerance to salinity, heavy-metal stresses, and Botrytis cinerea infection). Recognizes microbe-derived N-acetylglucosamine (NAG)- containing ligands. Involved in the resistance to pathogenic fungi Alternaria brassicicola and Erysiphe cichoracearum, probably by sensing microbe-associated molecular patterns (MAMP) and pathogen-associated molecular patt [...] 
81	AT5G51300	3702.Q9LU44	SF1	Splicing factor-like protein 1; Necessary for the splicing of pre-mRNA. Required during development and for abscisic acid (ABA) responses. Belongs to the BBP/SF1 family.
82	AT5G51300	3702.Q9LU44	SF1	Splicing factor-like protein 1; Necessary for the splicing of pre-mRNA. Required during development and for abscisic acid (ABA) responses. Belongs to the BBP/SF1 family.
83	AT5G57610	3702.Q9FKL3	MUA2.19	Kinase superfamily with octicosapeptide/Phox/Bem1p domain-containing protein.
84	AT1G63120	3702.Q9CAN1	RBL2	RHOMBOID-like protein 2; Rhomboid-type serine protease that catalyzes intramembrane proteolysis. Can cleave the Drosophila proteins Spitz and Keren. May function in pollen elongation.
85	AT5G42000	3702.Q9FHY3	MJC20.10	ORMDL family protein.
86	AT5G51300	3702.Q9LU44	SF1	Splicing factor-like protein 1; Necessary for the splicing of pre-mRNA. Required during development and for abscisic acid (ABA) responses. Belongs to the BBP/SF1 family.
87	AT5G47010	3702.Q9FJR0	UPF1	Regulator of nonsense transcripts 1 homolog; Involved in nonsense-mediated decay (NMD) of mRNAs containing premature stop codons (premature termination codon PTC) by associating with the nuclear exon junction complex (EJC) and serving as link between the EJC core and NMD machinery. Eliminates the production of nonsense-containing RNAs (ncRNAs). Required for plant development and adaptation to environmental stresses, including plant defense and response to wounding. Belongs to the DNA2/NAM7 helicase family.
88	AT2G26210	3702.Q8VZ34	T1D16.15	Ankyrin repeat family protein.
89	AT5G13000	3702.Q9LXT9	CALS3	Callose synthase 3; Involved in callose synthesis at the forming cell plate during cytokinesis. During plant growth and development, callose is found as a transitory component of the cell plate in dividing cells, is a major component of pollen mother cell walls and pollen tubes, and is found as a structural component of plasmodesmatal canals (By similarity); Belongs to the glycosyltransferase 48 family.
90	AT1G79740	3702.F4HQA2	F19K16.28	HAT transposon superfamily.
91	AT1G78230	3702.F4IA60	T11I11.17	Outer arm dynein light chain 1 protein.
92	AT2G27030	3702.Q682T9	CAM5	Calmodulin-5; Calmodulin mediates the control of a large number of enzymes, ion channels and other proteins by Ca(2+). Among the enzymes to be stimulated by the calmodulin-Ca(2+) complex are a number of protein kinases and phosphatases.
93	AT2G41110	3702.P0DH97	CAM2	Calmodulin-2; Calmodulin mediates the control of a large number of enzymes, ion channels and other proteins by Ca(2+). Among the enzymes to be stimulated by the calmodulin-Ca(2+) complex are a number of protein kinases and phosphatases.
94	AT3G56800	3702.P0DH98	CAM3	Calmodulin-3; Calmodulin mediates the control of a large number of enzymes, ion channels and other proteins by Ca(2+). Among the enzymes to be stimulated by the calmodulin-Ca(2+) complex are a number of protein kinases and phosphatases. Activates MPK8 in vitro.
95	AT1G06210	3702.Q9LNC6	TOL2	TOM1-like protein 2; Binds ubiquitin in vitro. Might contribute to the loading of the ESCRT machinery (Probable). Belongs to the TOM1 family.
96	AT5G35750	3702.Q9C5U2	AHK2	Histidine kinase 2; Cytokinins (CK) receptor related to bacterial two-component regulators. Functions as a histidine kinase and transmits the stress signal to a downstream MAPK cascade. This protein undergoes an ATP- dependent autophosphorylation at a conserved histidine residue in the kinase core, and a phosphoryl group is then transferred to a conserved aspartate residue in the receiver domain. In the presence of cytokinin, feeds phosphate to phosphorelay-integrating histidine phosphotransfer protein (HPt) and activates subsequent cascade. Involved in meristems establishment in seedl [...] 
97	AT4G21210	3702.O49562	RP1	Pyruvate, phosphate dikinase regulatory protein 1, chloroplastic; Bifunctional serine/threonine kinase and phosphorylase involved in the dark/light-mediated regulation of PPDK by catalyzing its phosphorylation/dephosphorylation. Dark/light-induced changes in stromal concentrations of the competing ADP and Pi substrates govern the direction of the reaction. In the dark, phosphorylates the catalytic intermediate of PPDK (PPDK-HisP), inactivating it. Light exposure induces the phosphorolysis reaction that reactivates PPDK. Unlike the kinase function which can utilize either Thr or Ser as  [...] 
98	AT1G55350	3702.Q8RVL2	DEK1	Calpain-type cysteine protease DEK1; Essential protease involved in epiderm development. Required for aleurone cell development in the endosperm probably by maintaining and restricting the aleurone and embryonic epidermal L1 cell-layer fates as well as meristems organization. Involved in the maintenance of adaxial/abaxial axis information in developing leaves, probably by regulating cell proliferation and expansion. Does not need calcium ions to be active. Required for the formation of giant cells in sepals by determining cell fate and promoting endoreplication.
